{
  "schema": "condorcet/run/v1",
  "id": "run:s256:3ff70a1e6c690519979f124fea53cee24a03a33b1797e6a5437d9260971d83ef",
  "bundle": "bundle:s256:07ed2a61b34cbb7983d3ca61b63be1b406eab1d0bc69677a37f861205f14d539",
  "adapter": {
    "id": "org",
    "version": "0.1",
    "revision": "git:ab12cd34"
  },
  "profile": {
    "name": "gate-strict",
    "version": "1"
  },
  "composers": [
    "sat-core@1",
    "wmc-exact@1",
    "logodds-clusters@1"
  ],
  "seed": 0,
  "memo_key": "s256:0b80bec7bf1b2d5121f91c0b04473a732e23183f3a4d423a28df267fd60a8354",
  "steps": [
    {
      "composer": "sat-core@1",
      "role": "gate",
      "status": "ok",
      "outputs": {
        "satisfiable": true
      },
      "evidence": [
        {
          "kind": "model",
          "ids": [
            "org:clx/fct-a1"
          ],
          "data": {
            "true": [
              "org:clx/fct-a1"
            ],
            "false": [
              "org:clx/fct-b2"
            ]
          }
        }
      ]
    },
    {
      "composer": "wmc-exact@1",
      "role": "gate",
      "status": "ok",
      "params": {
        "encoding": "source-reliability"
      },
      "outputs": {
        "marginal": {
          "org:clx/fct-a1": 0.31,
          "org:clx/fct-b2": 0.19,
          "org:clx/def-clock": 0.5
        },
        "joint": {
          "org:clx/fct-a1+org:clx/def-clock": 0.0
        },
        "partition": 1.0
      },
      "evidence": [
        {
          "kind": "note",
          "data": "ILLUSTRATIVE values showing the record shape; not produced by an engine."
        }
      ],
      "elapsed_ms": 3
    },
    {
      "composer": "logodds-clusters@1",
      "role": "baseline",
      "status": "ok",
      "outputs": {
        "marginal": {
          "org:clx/fct-a1": 0.95
        }
      },
      "elapsed_ms": 1
    }
  ],
  "gates": [
    {
      "id": "consistent",
      "passed": true
    },
    {
      "id": "joint-floor",
      "passed": false,
      "detail": "joint(load_bearing)=0.31 < 0.5"
    }
  ],
  "verdict": "fail",
  "created_at": "2026-10-10T00:00:00Z"
}
